id, name, description, defense, resistance, speed, Water Affect, Fire Affect, Ice Affect, Electric Affect, Slash Affect, Pierce Affect, Blunt Affect
0,Dragon Ward,Hardened skinned, 10, 8, 10, weak, nulls, cripples, normal, resists, resists, normal
1,Phoenix Ward,Fire, 10, 8, 10, weak, reflects, cripples, normal, normal, knocked, normal
2,Bumblebee Ward,Hardened skinned, 10, 8, 10, normal, leathal, cripples, normal, normal, weak, knocked
3,Neutral Ward,Purely Neutral, 5, 5, 20, normal,normal,normal,normal,normal,normal, normal
4,Speed Ward,Purely Neutral, 1, 1, 30, cripples,normal,normal,nulls,normal,weak, resists